0x20d6 0x4002
dev =  DEVICE ID 20d6:4002 on Bus 002 Address 014 =================
 bLength                :   0x12 (18 bytes)
 bDescriptorType        :    0x1 Device
 bcdUSB                 :  0x200 USB 2.0
 bDeviceClass           :   0xff Vendor-specific
 bDeviceSubClass        :   0x47
 bDeviceProtocol        :   0xd0
 bMaxPacketSize0        :   0x40 (64 bytes)
 idVendor               : 0x20d6
 idProduct              : 0x4002
 bcdDevice              :  0x101 Device 1.01
 iManufacturer          :    0x1 PowerA
 iProduct               :    0x2 XBX Spectra Enhanced Wired Controller
 iSerialNumber          :    0x3 00000120F5689D47
 bNumConfigurations     :    0x1
  CONFIGURATION 1: 500 mA ==================================
   bLength              :    0x9 (9 bytes)
   bDescriptorType      :    0x2 Configuration
   wTotalLength         :   0x40 (64 bytes)
   bNumInterfaces       :    0x2
   bConfigurationValue  :    0x1
   iConfiguration       :    0x0
   bmAttributes         :   0xa0 Bus Powered, Remote Wakeup
   bMaxPower            :   0xfa (500 mA)
    INTERFACE 0: Vendor Specific ===========================
     bLength            :    0x9 (9 bytes)
     bDescriptorType    :    0x4 Interface
     bInterfaceNumber   :    0x0
     bAlternateSetting  :    0x0
     bNumEndpoints      :    0x2
     bInterfaceClass    :   0xff Vendor Specific
     bInterfaceSubClass :   0x47
     bInterfaceProtocol :   0xd0
     iInterface         :    0x0
      ENDPOINT 0x1: Interrupt OUT ==========================
       bLength          :    0x7 (7 bytes)
       bDescriptorType  :    0x5 Endpoint
       bEndpointAddress :    0x1 OUT
       bmAttributes     :    0x3 Interrupt
       wMaxPacketSize   :   0x40 (64 bytes)
       bInterval        :    0x4
      ENDPOINT 0x81: Interrupt IN ==========================
       bLength          :    0x7 (7 bytes)
       bDescriptorType  :    0x5 Endpoint
       bEndpointAddress :   0x81 IN
       bmAttributes     :    0x3 Interrupt
       wMaxPacketSize   :   0x40 (64 bytes)
       bInterval        :    0x4
    INTERFACE 1: Vendor Specific ===========================
     bLength            :    0x9 (9 bytes)
     bDescriptorType    :    0x4 Interface
     bInterfaceNumber   :    0x1
     bAlternateSetting  :    0x0
     bNumEndpoints      :    0x0
     bInterfaceClass    :   0xff Vendor Specific
     bInterfaceSubClass :   0x47
     bInterfaceProtocol :   0xd0
     iInterface         :    0x0
    INTERFACE 1, 1: Vendor Specific ========================
     bLength            :    0x9 (9 bytes)
     bDescriptorType    :    0x4 Interface
     bInterfaceNumber   :    0x1
     bAlternateSetting  :    0x1
     bNumEndpoints      :    0x2
     bInterfaceClass    :   0xff Vendor Specific
     bInterfaceSubClass :   0x47
     bInterfaceProtocol :   0xd0
     iInterface         :    0x0
      ENDPOINT 0x8: Isochronous OUT ========================
       bLength          :    0x7 (7 bytes)
       bDescriptorType  :    0x5 Endpoint
       bEndpointAddress :    0x8 OUT
       bmAttributes     :    0x1 Isochronous
       wMaxPacketSize   :   0xe4 (228 bytes)
       bInterval        :    0x1
      ENDPOINT 0x87: Isochronous IN ========================
       bLength          :    0x7 (7 bytes)
       bDescriptorType  :    0x5 Endpoint
       bEndpointAddress :   0x87 IN
       bmAttributes     :    0x1 Isochronous
       wMaxPacketSize   :   0x40 (64 bytes)
       bInterval        :    0x1
ep  =        ENDPOINT 0x81: Interrupt IN ==========================
       bLength          :    0x7 (7 bytes)
       bDescriptorType  :    0x5 Endpoint
       bEndpointAddress :   0x81 IN
       bmAttributes     :    0x3 Interrupt
       wMaxPacketSize   :   0x40 (64 bytes)
       bInterval        :    0x4
i   =  0
epaddr =  129

